>>> import usb
>>> dev = usb.core.find()
>>> print dev
DEVICE ID 054c:06c3 on Bus 020 Address 008 =================
 bLength                :   0x12 (18 bytes)
 bDescriptorType        :    0x1 Device
 bcdUSB                 :  0x200 USB 2.0
 bDeviceClass           :   0xff Vendor-specific
 bDeviceSubClass        :    0x0
 bDeviceProtocol        :    0x0
 bMaxPacketSize0        :   0x40 (64 bytes)
 idVendor               : 0x054c
 idProduct              : 0x06c3
 bcdDevice              :  0x111 Device 1.11
 iManufacturer          :    0x1 SONY
 iProduct               :    0x2 RC-S380/P
 iSerialNumber          :    0x4 0286956
 bNumConfigurations     :    0x1
  CONFIGURATION 1: 200 mA ==================================
   bLength              :    0x9 (9 bytes)
   bDescriptorType      :    0x2 Configuration
   wTotalLength         :   0x20 (32 bytes)
   bNumInterfaces       :    0x1
   bConfigurationValue  :    0x1
   iConfiguration       :    0x0 
   bmAttributes         :   0x80 Bus Powered
   bMaxPower            :   0x64 (200 mA)
    INTERFACE 0: Vendor Specific ===========================
     bLength            :    0x9 (9 bytes)
     bDescriptorType    :    0x4 Interface
     bInterfaceNumber   :    0x0
     bAlternateSetting  :    0x0
     bNumEndpoints      :    0x2
     bInterfaceClass    :   0xff Vendor Specific
     bInterfaceSubClass :    0x0
     bInterfaceProtocol :    0x0
     iInterface         :    0x0 
      ENDPOINT 0x2: Bulk OUT ===============================
       bLength          :    0x7 (7 bytes)
       bDescriptorType  :    0x5 Endpoint
       bEndpointAddress :    0x2 OUT
       bmAttributes     :    0x2 Bulk
       wMaxPacketSize   :   0x40 (64 bytes)
       bInterval        :    0x0
      ENDPOINT 0x81: Bulk IN ===============================
       bLength          :    0x7 (7 bytes)
       bDescriptorType  :    0x5 Endpoint
       bEndpointAddress :   0x81 IN
       bmAttributes     :    0x2 Bulk
       wMaxPacketSize   :   0x40 (64 bytes)
       bInterval        :    0x0
>>> 
